{
  "report_info": {
    "year": 2025,
    "quarter": 2,
    "data_source": "국가데이터처 국가통계포털(KOSIS), 광업제조업동향조사"
  },
  "nationwide_data": {
    "production_index": 114.4,
    "growth_rate": 2.1,
    "growth_direction": "증가",
    "main_increase_industries": [
      {
        "name": "반도체·전자부품",
        "growth_rate": 11.1,
        "contribution": 1.833428
      },
      {
        "name": "기타 운송장비",
        "growth_rate": 26.6,
        "contribution": 0.599607
      },
      {
        "name": "의료·정밀",
        "growth_rate": 12.6,
        "contribution": 0.227945
      },
      {
        "name": "의약품",
        "growth_rate": 3.7,
        "contribution": 0.127732
      },
      {
        "name": "산업용기계",
        "growth_rate": 4.2,
        "contribution": 0.039725
      }
    ],
    "main_decrease_industries": [
      {
        "name": "비금속광물",
        "growth_rate": -11.7,
        "contribution": -0.192125
      },
      {
        "name": "화학물질",
        "growth_rate": -2.6,
        "contribution": -0.111589
      },
      {
        "name": "자동차·트레일러",
        "growth_rate": -0.6,
        "contribution": -0.070596
      },
      {
        "name": "음료",
        "growth_rate": -6.0,
        "contribution": -0.056843
      },
      {
        "name": "고무·플라스틱",
        "growth_rate": -1.8,
        "contribution": -0.056671
      }
    ]
  },
  "regional_data": {
    "increase_regions": [
      {
        "region": "충북",
        "growth_rate": 14.1,
        "top_industries": [
          {
            "name": "반도체·전자부품",
            "growth_rate": 29.4,
            "contribution": 7.279083
          },
          {
            "name": "전기장비",
            "growth_rate": 57.6,
            "contribution": 4.580136
          },
          {
            "name": "의약품",
            "growth_rate": 20.1,
            "contribution": 2.428167
          }
        ]
      },
      {
        "region": "경기",
        "growth_rate": 12.3,
        "top_industries": [
          {
            "name": "반도체·전자부품",
            "growth_rate": 18.9,
            "contribution": 10.994545
          },
          {
            "name": "기타기계장비",
            "growth_rate": 14.8,
            "contribution": 0.953268
          },
          {
            "name": "의료·정밀",
            "growth_rate": 32.3,
            "contribution": 0.755644
          }
        ]
      },
      {
        "region": "광주",
        "growth_rate": 11.3,
        "top_industries": [
          {
            "name": "전기장비",
            "growth_rate": 51.5,
            "contribution": 6.130791
          },
          {
            "name": "담배",
            "growth_rate": 72.5,
            "contribution": 5.351889
          },
          {
            "name": "자동차·트레일러",
            "growth_rate": 10.0,
            "contribution": 3.054246
          }
        ]
      },
      {
        "region": "경북",
        "growth_rate": 4.1,
        "top_industries": [
          {
            "name": "금속가공제품",
            "growth_rate": 45.7,
            "contribution": 3.218184
          },
          {
            "name": "반도체·전자부품",
            "growth_rate": 12.6,
            "contribution": 2.26433
          },
          {
            "name": "1차금속",
            "growth_rate": 1.5,
            "contribution": 0.20035
          }
        ]
      },
      {
        "region": "울산",
        "growth_rate": 2.5,
        "top_industries": [
          {
            "name": "기타 운송장비",
            "growth_rate": 34.9,
            "contribution": 2.853608
          },
          {
            "name": "기타기계장비",
            "growth_rate": 16.9,
            "contribution": 0.767413
          },
          {
            "name": "전기·가스업",
            "growth_rate": 12.2,
            "contribution": 0.606514
          }
        ]
      },
      {
        "region": "강원",
        "growth_rate": 0.3,
        "top_industries": [
          {
            "name": "전기·가스업",
            "growth_rate": 18.8,
            "contribution": 2.073299
          },
          {
            "name": "의약품",
            "growth_rate": 12.9,
            "contribution": 0.976069
          },
          {
            "name": "식료품",
            "growth_rate": 4.4,
            "contribution": 0.591601
          }
        ]
      }
    ],
    "decrease_regions": [
      {
        "region": "서울",
        "growth_rate": -10.1,
        "top_industries": [
          {
            "name": "의료·정밀",
            "growth_rate": -27.2,
            "contribution": -3.608619
          },
          {
            "name": "전기·가스업",
            "growth_rate": -30.9,
            "contribution": -3.209399
          },
          {
            "name": "식료품",
            "growth_rate": -9.7,
            "contribution": -1.186984
          }
        ]
      },
      {
        "region": "충남",
        "growth_rate": -6.4,
        "top_industries": [
          {
            "name": "반도체·전자부품",
            "growth_rate": -12.7,
            "contribution": -3.740907
          },
          {
            "name": "전기장비",
            "growth_rate": -25.7,
            "contribution": -0.857651
          },
          {
            "name": "전기·가스업",
            "growth_rate": -16.0,
            "contribution": -0.834636
          }
        ]
      },
      {
        "region": "부산",
        "growth_rate": -4.0,
        "top_industries": [
          {
            "name": "1차금속",
            "growth_rate": -9.9,
            "contribution": -1.27692
          },
          {
            "name": "기타 운송장비",
            "growth_rate": -19.6,
            "contribution": -1.217927
          },
          {
            "name": "금속가공제품",
            "growth_rate": -10.9,
            "contribution": -1.075038
          }
        ]
      },
      {
        "region": "인천",
        "growth_rate": -3.7,
        "top_industries": [
          {
            "name": "기타기계장비",
            "growth_rate": -15.8,
            "contribution": -3.012011
          },
          {
            "name": "의료·정밀",
            "growth_rate": -42.2,
            "contribution": -1.144608
          },
          {
            "name": "전기장비",
            "growth_rate": -13.5,
            "contribution": -0.430394
          }
        ]
      },
      {
        "region": "세종",
        "growth_rate": -3.4,
        "top_industries": [
          {
            "name": "반도체·전자부품",
            "growth_rate": -8.9,
            "contribution": -1.537704
          },
          {
            "name": "음료",
            "growth_rate": -72.7,
            "contribution": -1.478389
          },
          {
            "name": "전기장비",
            "growth_rate": -12.9,
            "contribution": -1.469489
          }
        ]
      },
      {
        "region": "대구",
        "growth_rate": -2.2,
        "top_industries": [
          {
            "name": "의료·정밀",
            "growth_rate": -28.5,
            "contribution": -1.66338
          },
          {
            "name": "금속가공제품",
            "growth_rate": -10.4,
            "contribution": -1.444439
          },
          {
            "name": "섬유제품",
            "growth_rate": -9.8,
            "contribution": -0.702919
          }
        ]
      },
      {
        "region": "제주",
        "growth_rate": -2.2,
        "top_industries": [
          {
            "name": "음료",
            "growth_rate": -8.0,
            "contribution": -2.602347
          },
          {
            "name": "비금속광물",
            "growth_rate": -18.9,
            "contribution": -1.350814
          },
          {
            "name": "식료품",
            "growth_rate": -2.9,
            "contribution": -0.482775
          }
        ]
      },
      {
        "region": "전남",
        "growth_rate": -1.7,
        "top_industries": [
          {
            "name": "화학물질",
            "growth_rate": -3.2,
            "contribution": -1.109703
          },
          {
            "name": "기타 운송장비",
            "growth_rate": -8.6,
            "contribution": -0.552457
          },
          {
            "name": "전기장비",
            "growth_rate": -51.4,
            "contribution": -0.529598
          }
        ]
      },
      {
        "region": "전북",
        "growth_rate": -1.3,
        "top_industries": [
          {
            "name": "화학물질",
            "growth_rate": -7.8,
            "contribution": -1.015434
          },
          {
            "name": "음료",
            "growth_rate": -16.3,
            "contribution": -0.598588
          },
          {
            "name": "고무·플라스틱",
            "growth_rate": -15.3,
            "contribution": -0.458588
          }
        ]
      },
      {
        "region": "경남",
        "growth_rate": -1.1,
        "top_industries": [
          {
            "name": "전기장비",
            "growth_rate": -15.2,
            "contribution": -1.213235
          },
          {
            "name": "자동차·트레일러",
            "growth_rate": -4.9,
            "contribution": -0.796168
          },
          {
            "name": "비금속광물",
            "growth_rate": -21.3,
            "contribution": -0.268193
          }
        ]
      },
      {
        "region": "대전",
        "growth_rate": -0.6,
        "top_industries": [
          {
            "name": "담배",
            "growth_rate": -10.4,
            "contribution": -1.97069
          },
          {
            "name": "기타기계장비",
            "growth_rate": -12.6,
            "contribution": -1.876435
          },
          {
            "name": "전기장비",
            "growth_rate": -20.4,
            "contribution": -1.336446
          }
        ]
      }
    ],
    "region_count": 6
  },
  "summary_box": {
    "main_increase_regions": [
      {
        "region": "충북",
        "industries": [
          "반도체·전자부품",
          "전기장비"
        ]
      },
      {
        "region": "경기",
        "industries": [
          "반도체·전자부품",
          "기타기계장비"
        ]
      },
      {
        "region": "광주",
        "industries": [